FSA_CODE,County,State,Crop Name,Type Name,Grazing Period Start Date,Grazing Period End Date
49007,Carbon,Utah,Grass,Crested Wheat; Native; Western Wheatgrass,2022-04-14,2022-10-31
49007,Carbon,Utah,Grass,Native; Orchard,2022-05-18,2022-10-15
49007,Carbon,Utah,Mixed Forage,Alfalfa Grass Mixture; Alfalfa Grass Mixture; Alfalfa Small Grain Interseeded; Grass Mix-Below 25% Alfalfa,2022-05-18,2022-10-15
49007,Carbon,Utah,Grass,Perennial Ryegrass,2022-06-03,2022-10-31
49007,Carbon,Utah,Mixed Forage,2 Or More Interseeded Small Grains; Grass/Small Grain Interseeding; Small Grain/Grass/Vegetable Interseeded; Small Grain/Legume/ Vegetable Interseeded,2022-06-03,2022-10-31
